no,name,kana,type,url
591,ピナクル株式会社,ピナクル,正会員,https://www.pinnacle.co.jp
592,ファイルフォース株式会社,ファイルフォース,正会員,https://www.fileforce.jp
593,株式会社ファイン,ファイン,正会員,https://www.fine-d.co.jp/
594,ファインディ株式会社,ファインディ,正会員,https://findy.co.jp/
595,株式会社ファインドゲート,ファインドゲート,正会員,https://www.findgate.co.jp/
596,FunTre株式会社,ファントレ,正会員,https://funtre.co.jp/
597,フィデル・テクノロジーズ株式会社,フィデルテクノロジーズ,正会員,https://fideltech.jp/
598,フェアシステム株式会社,フェアシステム,正会員,https://www.fairsystem.co.jp/
599,フェリタス社会保険労務士法人,フェリタスシャカイホケンロウムシホウジン,正会員,https://www.ishikawa-sk.com/
600,フォーエム株式会社,フォーエム,正会員,https://web.fourm.co.jp/
601,株式会社フォーカスシステムズ,フォーカスシステムズ,正会員,https://www.focus-s.com/
602,株式会社フォーサイト,フォーサイト,正会員,https://www.fsight-inc.co.jp/index.html
603,フォースバレー・コンシェルジュ株式会社,フォースバレーコンシェルジュ,正会員,https://www.4th-valley.com/
604,株式会社400F,フォーハンドレッドエフ,正会員,https://400f.jp/
605,株式会社フォーラムエイト,フォーラムエイト,正会員,http://www.forum8.co.jp/
606,株式会社フォスターネット,フォスターネット,正会員,https://foster-net.co.jp/
607,株式会社FoxitJapan,フォックスイットジャパン,正会員,http://www.foxit.co.jp
608,株式会社フォトハイウェイ・ジャパン,フォトハイウェイジャパン,正会員,https://gbnavi.jp/
609,株式会社フォトロン,フォトロン,正会員,http://www.photron.co.jp/
610,フォルテックス株式会社,フォルテックス,正会員,https://www.fortex-inc.co.jp
611,社会保険労務士法人FORROU,フォロー,正会員,https://forrou-sr.jp
612,株式会社PHONE APPLI,フォンアプリ,正会員,https://phoneappli.net/
613,福井コンピュータホールディングス株式会社,フクイコンピュータホールディングス,正会員,https://www.fukuicompu.co.jp/
614,富士通株式会社,フジツウ,特別賛助会員,https://www.fujitsu.com/jp/
615,富士通コミュニケーションサービス株式会社,フジツウコミュニケーションサービス,正会員,http://www.fujitsu.com/jp/group/csl/
616,株式会社富士通ラーニングメディア,フジツウラーニングメディア,正会員,https://jp.fujitsu.com/group/flm/
617,株式会社富士通ラーニングメディア沖縄,フジツウラーニングメディアオキナワ,正会員,https://www.fujitsu.com/jp/group/flm/flmo/
618,株式会社富士通ラーニングメディア・スタッフ,フジツウラーニングメディアスタッフ,正会員,https://www.fujitsu.com/jp/group/flm/flms/
619,FUJIYAMA  BRIDGE LAB株式会社,フジヤマブリッジラボ,準会員,https://www.fujiyamabl.com/
620,株式会社フトゥーロ,フトゥーロ,正会員,http://co226.jp
621,フリービット株式会社,フリービット,正会員,http://www.freebit.com/
622,Frich株式会社,フリッチ,正会員,https://frich.co.jp/
623,フルタニ産業株式会社,フルタニサンギョウ,正会員,https://www.furutani-sangyou.co.jp/
624,フルライン株式会社,フルライン,正会員,https://www.full-line.co.jp/
625,ブライシス株式会社,ブライシス,正会員,http://www.brisys.co.jp/
626,ブルーテック株式会社,ブルーテック,正会員,https://bluetec.co.jp
627,株式会社BluePort,ブルーポート,正会員,https://blue-port.co.jp/
628,ブレークモア法律事務所,ブレークモアホウリツジムショ,正会員,http://www.blakemore.gr.jp
629,株式会社ブレーンバディ,ブレーンバディ,正会員,https://brainbuddy.co.jp/
630,プライマリー・アシスト株式会社,プライマリーアシスト,正会員,http://primary-assist.co.jp/
631,株式会社プライムインフォ,プライムインフォ,正会員,https://primeinfo.co.jp/
632,株式会社プラザ・イー,プラザイー,正会員,https://www.plaza-e.co.jp
633,株式会社プラスバリュー,プラスバリュー,正会員,https://plusv.jp/
634,プラナスソリューションズ株式会社,プラナスソリューションズ,正会員,https://www.prunus-sol.co.jp/
635,プラネットワークス株式会社,プラネットワークス,準会員,https://planetworks.co.jp/
636,Playflats合同会社,プレイフラッツ,正会員,https://playflats.com/
637,株式会社プレミアムアーツ,プレミアムアーツ,正会員,http://www.premiumartsinc.wix.com/pai001
638,株式会社プログデンス,プログデンス,正会員,https://www.progdence.co.jp/
639,税理士法人プログレス,プログレス,正会員,https://prgss.jp/
640,株式会社プロシップ,プロシップ,正会員,http://www.proship.co.jp/
641,株式会社プロズプラス,プロズプラス,正会員,https://prozplus.jp
642,社会福祉法人プロップ・ステーション,プロップステーション,一般賛助会員,https://www.prop.or.jp/
643,株式会社プロモーション,プロモーション,正会員,https://promotion.co.jp/
644,ベース株式会社,ベース,正会員,http://www.basenet.co.jp/
645,ベクターワークスジャパン株式会社,ベクターワークスジャパン,正会員,https://www.vectorworks.co.jp/
646,ベトリンクソリューションズ株式会社,ベトリンクソリューションズ,正会員,https://vietlink.jp/
647,ベリタステクノロジーズ合同会社,ベリタステクノロジーズ,正会員,https://www.veritas.com/ja/jp/company/corporate-profile
648,弁護士ドットコム株式会社,ベンゴシドットコム,正会員,https://www.bengo4.com/corporate/
649,株式会社ベンチャーエージェント,ベンチャーエージェント,準会員,https://www.venture-agent.com/
650,PagerDuty株式会社,ペイジャーデューティ,正会員,https://www.pagerduty.co.jp/
651,株式会社ホープクリエイト,ホープクリエイト,正会員,http://www.hcc-net.co.jp/
652,北海道　北見市,ホッカイドウ　キタミシ,行政会員,http://www.city.kitami.lg.jp/
653,一般社団法人北海道ＩＴ推進協会,ホッカイドウアイティスイシンキョウカイ,一般賛助会員,https://www.hicta.or.jp/
654,一般社団法人北海道情報システム産業協会,ホッカイドウジョウホウシステムサンギョウキョウカイ,一般賛助会員,http://www.hisa.gr.jp/
655,北海道　函館市,ホッカイドウハコダテシ,行政会員,http://www.city.hakodate.hokkaido.jp/
656,北港情報サービス株式会社,ホッコウジョウホウサービス,正会員,http://www.hokkohj.co.jp/
657,株式会社本間システム,ホンマシステム,正会員,
658,株式会社ボールド,ボールド,正会員,http://www.bold.ne.jp/
659,vonxai合同会社,ボンサイ,準会員,https://www.vonxai.co.jp/
660,ポスタス株式会社,ポスタス,正会員,https://www.postas.co.jp/
661,株式会社ポリフレクト,ポリフレクト,正会員,https://www.poliflect.co.jp/
662,マーキュリーHD株式会社,マーキュリーエイチディ,正会員,
663,株式会社Maas Tech Japan,マーステックジャパン,正会員,https://www.maas.co.jp/
664,株式会社マイクロメイツ,マイクロメイツ,正会員,https://www.micromates.co.jp/
665,MicroWorld株式会社,マイクロワールド,正会員,https://microworld.co.jp/
666,株式会社マイナビEdge,マイナビエッジ,試験会場会員,https://www.mynavi-edge.jp/
667,株式会社マイネットシステム,マイネットシステム,正会員,https://www.mynet-system.co.jp/
668,マイプラス株式会社,マイプラス,正会員,https://www.my-plus.co.jp/
669,株式会社豆蔵,マメゾウ,正会員,https://www.mamezou.com
670,株式会社豆蔵K2TOPホールディングス,マメゾウケーツートップホールディングス,正会員,https://www.mzk2.com/
671,マルワソフト株式会社,マルワソフト,正会員,https://www.maruwasoft.co.jp/
672,株式会社ミクロスソフトウエア,ミクロスソフトウエア,正会員,http://www.micros.co.jp/
673,株式会社ミック,ミック,正会員,https://www.mic.jp/
674,株式会社ミックウェアオートモーティブ,ミックウェアオートモーティブ,正会員,https://micware.co.jp/ja/group/automotive/
675,株式会社ミップス,ミップス,正会員,http://www.go-mips.co.jp/index.html
676,三菱ＵＦＪ信託銀行株式会社,ミツビシユーエフジェイシンタクギンコウ,一般賛助会員,https://www.tr.mufg.jp/
677,ミミワークス株式会社,ミミワークス,正会員,http://mimiworks.jp/
678,株式会社ミモザ情報システム,ミモザジョウホウシステム,正会員,https://www.mimosa.co.jp/
679,宮崎県　都城市,ミヤザキケンミヤコノジョウシ,行政会員,https://www.city.miyakonojo.miyazaki.jp/
680,株式会社ミラ,ミラ,正会員,https://www.madebymira.com/
681,株式会社未来研究所,ミライケンキュウショ,正会員,https://www.future-research.jp/
682,株式会社ミライル,ミライル,正会員,https://miraillu.co.jp/
683,株式会社ミロク情報サービス,ミロクジョウホウサービス,正会員,https://www.mjs.co.jp/
684,株式会社MOVED,ムーブド,正会員,https://www.moved.co.jp/
685,mui Lab株式会社,ムイラボ,正会員,https://muilab.com
686,名誉教授ドットコム株式会社,メイヨキョウジュドットコム,正会員,http://www.pedc.tohoku.org/
687,method bank 株式会社,メソッドバンク,正会員,https://methodbank.jp/
688,株式会社メディアシーク,メディアシーク,正会員,https://www.mediaseek.co.jp/
689,株式会社メディアミックス,メディアミックス,正会員,https://www.mediamix.inc/
690,株式会社メドミライ,メドミライ,正会員,https://www.medmirai.co.jp/
691,株式会社Mealthy,メルシー,正会員,https://mealthy.co.jp
692,株式会社ModelingX,モデリングエックス,準会員,https://modelingx.jp
693,モバイルコンピューティング推進コンソーシアム,モバイルコンピューティングスイシンコンソーシアム,一般賛助会員,http://www.mcpc-jp.org/
694,モビルス株式会社,モビルス,正会員,https://mobilus.co.jp
695,株式会社モンスター・ラボ,モンスターラボ,正会員,https://monstar-lab.com/monstarlab-jp-profile/
696,株式会社八雲ソフトウェア,ヤクモソフトウェア,正会員,https://8clouds.co.jp/
697,社会保険労務士山田事務所,ヤマダジムショ,正会員,https://www.sryamada.jp
698,弥生株式会社,ヤヨイ,正会員,https://www.yayoi-kk.co.jp/
699,株式会社ユーコム,ユーコム,正会員,https://www.youcom.co.jp/
700,ユーザックシステム株式会社,ユーザックシステム,正会員,https://www.usknet.com/
701,株式会社USTAGE,ユーステージ,正会員,https://www.ustage.net/
702,ユニインフォーメーション株式会社,ユニインフォーメーション,正会員,https://www.uni-info.co.jp/
703,株式会社ユニリタプラス,ユニリタプラス,正会員,http://www.uniritaplus.co.jp/
704,株式会社ユラスコア,ユラスコア,正会員,https://www.yurascore.co.jp/
705,株式会社ユニリタ,ユリニタ,正会員,https://www.unirita.co.jp/
706,株式会社横河技術情報,ヨコガワギジュツジョウホウ,正会員,https://www.yti.co.jp/
707,株式会社ライズ・マーケティング・ジャパン,ライズマーケティングジャパン,正会員,
708,株式会社ライトウェブ,ライトウェブ,正会員,https://lightweb.co.jp/
709,株式会社ライトコード,ライトコード,準会員,https://rightcode.co.jp/
710,株式会社ライフアカデミア,ライフアカデミア,準会員,https://life-academia.co.jp/
711,株式会社LIFE CREATE,ライフクリエイト,正会員,https://be-lifecreate.com/
712,LINEヤフー株式会社,ラインヤフー,正会員,https://www.lycorp.co.jp/
713,株式会社ラキール,ラキール,正会員,https://www.lakeel.com/
714,株式会社楽堂,ラクドウ,正会員,https://www.rakudou.co.jp
715,ラクラス株式会社,ラクラス,正会員,http://www.lacras.co.jp/
716,ラシックマーケティング株式会社,ラシックマーケティング,正会員,https://rashic.co.jp/
717,株式会社ラック,ラック,正会員,https://www.lac.co.jp
718,株式会社ラネクシー,ラネクシー,正会員,https://www.runexy.co.jp/
719,株式会社ラピート,ラピート,正会員,http://www.rapiit.com/
720,ラフゴ株式会社,ラフゴ,正会員,https://corp.lafugo.com
721,株式会社ラボル,ラボル,準会員,https://labol.co.jp/corp/
722,株式会社LegalOn Technologies,リーガルオンテクノロジーズ,正会員,https://legalontech.jp/
723,Lydsec Digital Technology Japan株式会社,リーセックデジタルテクノロジージャパン,正会員,https://www.lydsec.com/ja/
724,株式会社リアルソリューションズ,リアルソリューションズ,正会員,http://www.realsolutions.co.jp/
725,リアルネットワークス株式会社,リアルネットワークス,正会員,https://safr.com/ja/home/
726,株式会社理経,リケイ,正会員,http://www.rikei.co.jp
727,株式会社リコー,リコー,正会員,https://www.ricoh.co.jp/
728,リコーITソリューションズ株式会社,リコーアイティソリューションズ,正会員,http://www.jrits.co.jp
729,リコージャパン株式会社,リコージャパン,正会員,https://www.ricoh.co.jp/
730,Resource株式会社,リソース,準会員,https://resource-inc.com/company
731,学校法人立志舎,リッシシャ,一般賛助会員,https://www.all-japan.ac.jp/
732,株式会社栗菱コンピューターズ,リツリョウコンピューターズ,正会員,https://ritsuryo.co.jp/
733,リデン株式会社,リデン,正会員,https://www.reden.co.jp
734,株式会社LITORY,リトリー,準会員,https://litory.jp/
735,株式会社リトルソフトウェア,リトルソフトウェア,正会員,https://www.littlesoftware.jp/
736,株式会社Rehab for JAPAN,リハブフォージャパン,正会員,https://rehabforjapan.com/
737,リバティ・フィッシュ株式会社,リバティフィッシュ,正会員,https://www.libertyfish.co.jp
738,株式会社Re-Build,リビルド,正会員,https://www.re-builds.co.jp/
739,株式会社リファクト,リファクト,正会員,https://www.refact.co.jp/
740,株式会社リフカム,リフカム,準会員,https://about.refcome.com/
741,株式会社LIFRELL,リフレール,準会員,https://lifrell.co.jp/
742,株式会社リボルブ沖縄,リボルブオキナワ,正会員,https://www.revolveok.co.jp/
743,株式会社リボルブ・シス,リボルブシス,正会員,https://www.revolvesys.co.jp/
744,株式会社リメディア,リメディア,正会員,http://www.remedia.co.jp/
745,株式会社リンクス,リンクス,正会員,http://links-system.co.jp/
746,ルークコンサルタンツ株式会社,ルークコンサルタンツ,正会員,
747,株式会社ルートプロ,ルートプロ,正会員,http://rootpro.jp/
748,一般社団法人Ｒｕｂｙビジネス推進協議会,ルビービジネススイシンキョウギカイ,一般賛助会員,https://www.ruby-b.com/
749,株式会社ルリアン,ルリアン,正会員,https://le-lien.co.jp/
750,レッドアークラボラトリーズ合同会社,レッドアークラボラトリーズ,準会員,https://corp.rals.space
751,レバテック株式会社,レバテック,正会員,https://levtech.jp/company/
752,レヴィアス株式会社,レヴィアス,正会員,https://levias.co.jp/
753,六元素情報システム株式会社,ロクゲンソジョウホウシステム,正会員,http://www.rgsis.com/
754,ログオーシャン株式会社,ログオーシャン,正会員,http://www.locn.co.jp
755,株式会社ロジックベイン,ロジックベイン,正会員,https://www.lvi.co.jp/
756,ロジテックINAソリューションズ株式会社,ロジテックアイエヌエーソリューションズ,正会員,https://www.logitec.co.jp/
757,ロック・ストアー・ハウス株式会社,ロックストアーハウス,正会員,https://www.r-sh.co.jp/
758,株式会社ロックトゥーン,ロックトゥーン,準会員,https://www.rocktoon.co.jp/
759,株式会社ROBON,ロボン,正会員,https://www.robon.co.jp/
760,株式会社ワークスアプリケーションズ,ワークスアプリケーションズ,正会員,https://www.worksap.co.jp/
761,株式会社ワークスアプリケーションズ・フロンティア,ワークスアプリケーションズフロンティア,正会員,https://www.worksap.co.jp/frontier/
762,株式会社Works Human Intelligence,ワークスヒューマンインテリジェンス,正会員,https://www.works-hi.co.jp
763,株式会社ワークスビジネスサービス,ワークスビジネスサービス,正会員,
764,ワークデザイン福田合同会社,ワークデザインフクダ,準会員,
765,株式会社ワイズ・マーケティング,ワイズマーケティング,正会員,http://www.ymktg.com
766,株式会社Yメディカル,ワイメディカル,正会員,
767,和歌山県,ワカヤマケン,行政会員,https://ritti.pref.wakayama.jp/ict/
768,株式会社ワコム,ワコム,正会員,https://www.wacom.com/ja-jp
769,ワンビ株式会社,ワンビ,正会員,http://www.onebe.co.jp/
770,Verticurl Japan合同会社,ヴァーティカルジャパン,正会員,https://www.verticurl.co.jp/
771,株式会社ヴァル研究所,ヴァルケンキュウジョ,正会員,https://www.val.co.jp/
772,株式会社日本ソフトウェアブレイン,二ホンソフトウェアブレイン,準会員,https://nsbrain.co.jp/
701,株式会社USTAGE,ユーステージ,正会員,https://www.ustage.net/
702,ユニインフォーメーション株式会社,ユニインフォーメーション,正会員,https://www.uni-info.co.jp/
703,株式会社ユニリタプラス,ユニリタプラス,正会員,http://www.uniritaplus.co.jp/
704,株式会社ユラスコア,ユラスコア,正会員,https://www.yurascore.co.jp/
705,株式会社ユニリタ,ユリニタ,正会員,https://www.unirita.co.jp/
706,株式会社横河技術情報,ヨコガワギジュツジョウホウ,正会員,https://www.yti.co.jp/
707,株式会社ライズ・マーケティング・ジャパン,ライズマーケティングジャパン,正会員,
708,株式会社ライトウェブ,ライトウェブ,正会員,https://lightweb.co.jp/
709,株式会社ライトコード,ライトコード,準会員,https://rightcode.co.jp/
710,株式会社ライフアカデミア,ライフアカデミア,準会員,https://life-academia.co.jp/
711,株式会社LIFE CREATE,ライフクリエイト,正会員,https://be-lifecreate.com/
712,LINEヤフー株式会社,ラインヤフー,正会員,https://www.lycorp.co.jp/
713,株式会社ラキール,ラキール,正会員,https://www.lakeel.com/
714,株式会社楽堂,ラクドウ,正会員,https://www.rakudou.co.jp
715,ラクラス株式会社,ラクラス,正会員,http://www.lacras.co.jp/
716,ラシックマーケティング株式会社,ラシックマーケティング,正会員,https://rashic.co.jp/
717,株式会社ラック,ラック,正会員,https://www.lac.co.jp
718,株式会社ラネクシー,ラネクシー,正会員,https://www.runexy.co.jp/
719,株式会社ラピート,ラピート,正会員,http://www.rapiit.com/
720,ラフゴ株式会社,ラフゴ,正会員,https://corp.lafugo.com
721,株式会社ラボル,ラボル,準会員,https://labol.co.jp/corp/
722,株式会社LegalOn Technologies,リーガルオンテクノロジーズ,正会員,https://legalontech.jp/
723,Lydsec Digital Technology Japan株式会社,リーセックデジタルテクノロジージャパン,正会員,https://www.lydsec.com/ja/
724,株式会社リアルソリューションズ,リアルソリューションズ,正会員,http://www.realsolutions.co.jp/
725,リアルネットワークス株式会社,リアルネットワークス,正会員,https://safr.com/ja/home/
726,株式会社理経,リケイ,正会員,http://www.rikei.co.jp
727,株式会社リコー,リコー,正会員,https://www.ricoh.co.jp/
728,リコーITソリューションズ株式会社,リコーアイティソリューションズ,正会員,http://www.jrits.co.jp
729,リコージャパン株式会社,リコージャパン,正会員,https://www.ricoh.co.jp/
730,Resource株式会社,リソース,準会員,https://resource-inc.com/company
731,学校法人立志舎,リッシシャ,一般賛助会員,https://www.all-japan.ac.jp/
732,株式会社栗菱コンピューターズ,リツリョウコンピューターズ,正会員,https://ritsuryo.co.jp/
733,リデン株式会社,リデン,正会員,https://www.reden.co.jp
734,株式会社LITORY,リトリー,準会員,https://litory.jp/
735,株式会社リトルソフトウェア,リトルソフトウェア,正会員,https://www.littlesoftware.jp/
736,株式会社Rehab for JAPAN,リハブフォージャパン,正会員,https://rehabforjapan.com/
737,リバティ・フィッシュ株式会社,リバティフィッシュ,正会員,https://www.libertyfish.co.jp
738,株式会社Re-Build,リビルド,正会員,https://www.re-builds.co.jp/
739,株式会社リファクト,リファクト,正会員,https://www.refact.co.jp/
740,株式会社リフカム,リフカム,準会員,https://about.refcome.com/
741,株式会社LIFRELL,リフレール,準会員,https://lifrell.co.jp/
742,株式会社リボルブ沖縄,リボルブオキナワ,正会員,https://www.revolveok.co.jp/
743,株式会社リボルブ・シス,リボルブシス,正会員,https://www.revolvesys.co.jp/
744,株式会社リメディア,リメディア,正会員,http://www.remedia.co.jp/
745,株式会社リンクス,リンクス,正会員,http://links-system.co.jp/
746,ルークコンサルタンツ株式会社,ルークコンサルタンツ,正会員,
747,株式会社ルートプロ,ルートプロ,正会員,http://rootpro.jp/
748,一般社団法人Ｒｕｂｙビジネス推進協議会,ルビービジネススイシンキョウギカイ,一般賛助会員,https://www.ruby-b.com/
749,株式会社ルリアン,ルリアン,正会員,https://le-lien.co.jp/
750,レッドアークラボラトリーズ合同会社,レッドアークラボラトリーズ,準会員,https://corp.rals.space
751,レバテック株式会社,レバテック,正会員,https://levtech.jp/company/
752,レヴィアス株式会社,レヴィアス,正会員,https://levias.co.jp/
753,六元素情報システム株式会社,ロクゲンソジョウホウシステム,正会員,http://www.rgsis.com/
754,ログオーシャン株式会社,ログオーシャン,正会員,http://www.locn.co.jp
755,株式会社ロジックベイン,ロジックベイン,正会員,https://www.lvi.co.jp/
756,ロジテックINAソリューションズ株式会社,ロジテックアイエヌエーソリューションズ,正会員,https://www.logitec.co.jp/
757,ロック・ストアー・ハウス株式会社,ロックストアーハウス,正会員,https://www.r-sh.co.jp/
758,株式会社ロックトゥーン,ロックトゥーン,準会員,https://www.rocktoon.co.jp/
759,株式会社ROBON,ロボン,正会員,https://www.robon.co.jp/
760,株式会社ワークスアプリケーションズ,ワークスアプリケーションズ,正会員,https://www.worksap.co.jp/
761,株式会社ワークスアプリケーションズ・フロンティア,ワークスアプリケーションズフロンティア,正会員,https://www.worksap.co.jp/frontier/
762,株式会社Works Human Intelligence,ワークスヒューマンインテリジェンス,正会員,https://www.works-hi.co.jp
763,株式会社ワークスビジネスサービス,ワークスビジネスサービス,正会員,
764,ワークデザイン福田合同会社,ワークデザインフクダ,準会員,
765,株式会社ワイズ・マーケティング,ワイズマーケティング,正会員,http://www.ymktg.com
766,株式会社Yメディカル,ワイメディカル,正会員,
767,和歌山県,ワカヤマケン,行政会員,https://ritti.pref.wakayama.jp/ict/
768,株式会社ワコム,ワコム,正会員,https://www.wacom.com/ja-jp
769,ワンビ株式会社,ワンビ,正会員,http://www.onebe.co.jp/
770,Verticurl Japan合同会社,ヴァーティカルジャパン,正会員,https://www.verticurl.co.jp/
771,株式会社ヴァル研究所,ヴァルケンキュウジョ,正会員,https://www.val.co.jp/
772,株式会社日本ソフトウェアブレイン,二ホンソフトウェアブレイン,準会員,https://nsbrain.co.jp/
