no,name,kana,type,url
101,株式会社ウェッブアイ,ウェッブアイ,正会員,http://www.webi.co.jp
102,株式会社ウェブインパクト,ウェブインパクト,正会員,https://www.webimpact.co.jp/
103,株式会社ウェルキッズ,ウェルキッズ,正会員,https://www.wel-kids.co.jp/
104,株式会社ウエンズ,ウエンズ,正会員,https://wends.co.jp/
105,株式会社ウォーカー,ウォーカー,正会員,https://www.walker.co.jp/
106,株式会社ウチダ人材開発センタ,ウチダジンザイカイハツセンタ,正会員,https://www.uhd.co.jp/
107,株式会社内田洋行,ウチダヨウコウ,正会員,https://www.uchida.co.jp/
108,株式会社エーアイスピリッツ,エーアイスピリッツ,正会員,https://aispirits.com/
109,株式会社AMBC,エーエムビーシー,正会員,http://www.ambc.jp/
110,株式会社エージェント・インシュアランス・グループ,エージェントインシュアランスグループ,正会員,https://a-gent.co.jp/
111,AZPower株式会社,エーゼットパワー,正会員,https://azpower.co.jp
112,株式会社ATJC,エーティージェーシー,正会員,https://atjc-it.jp/
113,株式会社エーティーワークス,エーティーワークス,正会員,https://www.atworks.co.jp/
114,株式会社ai-Health,エイアイヘルス,正会員,http://ai-health.co.jp/
115,株式会社HRリンク,エイチアールリンク,準会員,https://hrlink.jp/
116,株式会社HICサービス,エイチアイシーサービス,正会員,http://www.hicservice.co.jp/
117,株式会社H&Eテクノロジー,エイチアンドイーテクノロジー,正会員,https://hri-global.co.jp/
118,エイチスリーパートナーズ有限会社,エイチスリーパートナーズ,正会員,https://www.ossplaza.com/
119,株式会社エイトレッド,エイトレッド,正会員,https://www.atled.jp/
120,株式会社エイワット,エイワット,正会員,https://eiwat.co.jp/
121,株式会社エクスト,エクスト,正会員,https://www.ext.ne.jp/
122,エクスペリオンインドコスモテクノロジース株式会社,エクスペリオンインドコスモテクノロジース,正会員,https://www.experion-indocosmo.co.jp
123,株式会社エクセルシア,エクセルシア,正会員,http://www.excelsior.co.jp/
124,株式会社エコ・ドルフィンズ,エコドルフインズ,準会員,
125,株式会社ＳＲＡ,エスアールエイ,正会員,https://www.sra.co.jp/
126,エスアールエム　テクノロジーズ　プライベート　リミテッド,エスアールエムテクノロジーズプライベートリミテッド,正会員,https://japan.srmtech.com
127,株式会社エスアイイー,エスアイイー,正会員,https://sie.co.jp/
128,株式会社エスアイ・システム,エスアイシステム,正会員,http://www.si-system.jp
129,株式会社SEデザイン,エスイーデザイン,正会員,https://www.sedesign.co.jp/
130,エス・エー・エス株式会社,エスエーエス,正会員,https://sas-com.com
131,株式会社SHP,エスエイチピー,正会員,https://socialhealth.co.jp
132,株式会社SNSソフト,エスエヌエスソフト,正会員,https://www.snssoft.co.jp
133,エスコ・ジャパン株式会社,エスコジャパン,正会員,https://www.escco.co.jp/
134,SCSK株式会社,エスシーエスケイ,正会員,https://www.scsk.jp/
135,SCデジタル株式会社,エスシーデジタル,正会員,https://www.scdigital.co.jp/
136,株式会社STVテック,エステイーブイテック,正会員,https://www.stv-tech.co.jp/
137,株式会社SDキャリアサポート,エスディーキャリアサポート,準会員,
138,SB C&S 株式会社,エスビーシーアンドエス,正会員,https://cas.softbank.jp/
139,SBテクノロジー株式会社,エスビーテクノロジー,正会員,https://www.softbanktech.co.jp/
140,株式会社ＳＰ ＥＸＰＥＲＴ’Ｓ,エスピーエキスパーツ,正会員,https://www.spexperts.co.jp/
141,株式会社エスペシャリィ,エスペシャリィ,正会員,https://especially.co.jp
142,一般社団法人XBRL Japan,エックスビーアールエルジャパン,一般賛助会員,http://www.xbrl.or.jp/
143,株式会社エッジコネクト,エッジコネクト,正会員,https://edge-con.co.jp/
144,株式会社NCP相続センター,エヌシーピソウゾクセンター,正会員,https://www.ncp-law.com/souzokucenter/index.html
145,NJCネットコミュニケーションズ株式会社,エヌジェーシーネットコミュニケーションズ,正会員,https://www.netcoms.ne.jp/
146,株式会社エヌ・ティ・ティエムイー,エヌティティエムイー,正会員,https://www.ntt-me.co.jp/
147,株式会社ＮＴＴドコモ,エヌティティドコモ,正会員,https://www.docomo.ne.jp/
148,株式会社NDR,エヌディーアール,正会員,https://www.ndr.ne.jp/
149,NPO地域づくり工房,エヌピーオーチイキヅクリコウボウ,正会員,http://npo.omachi.org/
150,NYKオフィス社会保険労務士法人,エヌワイケイオフィスシャカイホケンロウムシホウジン,正会員,http://www.nykoffice.net/
151,エフアンドエムネット株式会社,エフアンドエムネット,正会員,https://www.fandmnet.com/
152,株式会社F&Lソリューション,エフアンドエルソリューション,正会員,https://fl-sol.com/
153,株式会社FM. Bee,エフエムビー,正会員,http://www.fmbee.com/
154,エブリセンスジャパン株式会社,エブリセンスジャパン,正会員,https://every-sense.com/
155,エプソン販売株式会社,エプソンハンバイ,正会員,https://www.epson.jp/
156,ＭＲＴ株式会社,エムアールティ,正会員,http://medrt.co.jp
157,株式会社ＭＭ総研,エムエムソウケン,正会員,https://www.m2ri.jp/
158,株式会社eMoBi,エモビ,正会員,https://www.emobi.co.jp/
159,LIJ株式会社,エルアイジェイ,正会員,https://www.los-ij.co.jp/
160,株式会社エルテス,エルテス,正会員,https://eltes.co.jp/
161,特定非営利活動法人エルピーアイジャパン,エルピーアイジャパン,正会員,https://lpi.or.jp/
162,ELESTYLE株式会社,エレスタイル,正会員,https://elestyle.jp
163,エンカレッジ・テクノロジ株式会社,エンカレッジテクノロジ,正会員,http://www.et-x.jp/
164,株式会社エンジーニアス,エンジーニアス,準会員,https://engenius.co.jp/
165,株式会社エンジニアリングサムライ,エンジニアリングサムライ,準会員,https://www.engineering-samurai.com/
166,エンバカデロ・テクノロジーズ合同会社,エンバカデロテクノロジーズ,正会員,https://www.embarcadero.com/jp
167,特定非営利活動法人エンパワメントかながわ,エンパワメントカナガワ,準会員,https://npo-ek.org/
168,株式会社ＯＳＫ,オーエスケー,正会員,https://www.kk-osk.co.jp/
169,株式会社オークシステムソリューションズ,オークシステムソリューションズ,正会員,http://oakss.co.jp/
170,株式会社AWESOME SE,オーサムエスイー,準会員,https://www.awesomese.co.jp/
171,株式会社オーシーシー,オーシーシー,正会員,https://www.occ.co.jp
172,株式会社オービックビジネスコンサルタント,オービックビジネスコンサルタント,正会員,https://www.obc.co.jp/
173,株式会社オープンウェーブ,オープンウェーブ,正会員,http://www.openwave.co.jp/
174,株式会社オープンストリーム,オープンストリーム,正会員,https://www.opst.co.jp
175,オールウィンシステム株式会社,オールウィンシステム,正会員,https://allwinsys.co.jp/
176,応研株式会社,オウケン,正会員,http://www.ohken.co.jp/
177,学校法人大阪夕陽丘学園,オオサカユウヒガオカガクエン,一般賛助会員,https://www.oyg.ac.jp/
178,株式会社大塚商会,オオツカショウカイ,正会員,https://www.otsuka-shokai.co.jp/
179,学校法人大原学園,オオハラガクエン,一般賛助会員,https://www.o-hara.ac.jp/
180,税理士大矢隆啓事務所,オオヤタカヒロジムショ,正会員,
181,岡山県　岡山市,オカヤマケン　オカヤマシ,行政会員,https://www.city.okayama.jp/
182,一般財団法人沖縄ITイノベーション戦略センター,オキナワアイティイノベーションセンリャクセンター,一般賛助会員,https://isc-okinawa.org/
183,沖縄県　名護市,オキナワケン　ナゴシ,行政会員,http://www.city.nago.okinawa.jp/index.html
184,オデッセイヒューマンシステム株式会社,オデッセイヒューマンシステム,正会員,http://www.ohs-ndd.co.jp/
185,株式会社オプティム,オプティム,正会員,http://www.optim.co.jp/
186,株式会社オルツ,オルツ,正会員,https://alt.ai/
187,オレンジセキュアサービス株式会社,オレンジセキュアサービス,正会員,http://orange-ss.com/
188,株式会社オレンジリンクス,オレンジリンクス,正会員,http://orangelinks.co.jp/
189,株式会社カオス,カオス,正会員,http://www.caos-a.co.jp/
190,一般社団法人科学技術と経済の会,カガクギジュツトケイザイノカイ,一般賛助会員,http://www.jates.or.jp
191,一般社団法人神奈川県情報サービス産業協会,カナガワケンジョウホウサービスサンギョウキョウカイ,一般賛助会員,https://www.kia.or.jp
192,株式会社　三宅,カブシキガイシャ　ミヤケ,正会員,https://miyake-sec.com/
193,株式会社アマダナスポーツエンタテインメント,カブシキガイシャアマダナスポーツエンタテインメント,準会員,https://www.amadana-se.com/
194,株式会社カラダノート,カラダノート,正会員,https://corp.karadanote.jp/
195,株式会社川崎技術研究所,カワサキギジュツケンキュウショ,準会員,https://kawasaki-tech.co.jp/
196,河村電器産業株式会社,カワムラデンキサンギョウ,正会員,https://www.kawamura.co.jp/
197,関西エアポートオペレーションサービス株式会社,カンサイエアポートオペレーションサービス,正会員,http://www.ops.kansai-airports.co.jp/
198,一般財団法人関西情報センター,カンサイジョウホウセンター,一般賛助会員,http://www.kiis.or.jp
199,関東ＩＴソフトウェア健康保険組合,カントウアイティソフトウェアケンコウホケンクミアイ,一般賛助会員,https://www.its-kenpo.or.jp/
200,学校法人日本教育財団（東京国際工科専門職大学）,ガッコウホウジンニホンキョウイクザイダン（トウキョウコクサイコウカセンモンショクダイガク）,一般賛助会員,https://www.nkz.ac.jp/
201,株式会社ガバメイツ,ガバメイツ,正会員,https://govmates.jp/
202,紀尾井町戦略研究所株式会社,キオイチョウセンリャクケンキュウジョ,正会員,https://ksi-corp.jp/
203,公益社団法人企業情報化協会,キギョウジョウホウカキョウカイ,一般賛助会員,https://www.jiit.or.jp/
204,株式会社キッズウェイ,キッズウェイ,正会員,https://www.kids-way.ne.jp/
205,株式会社KITOHA,キトハ,正会員,http://kitoha.jp/
206,Casley Deep Innovations株式会社,キャスレーディープイノベーションズ,正会員,https://www.casleydi.com/
207,株式会社キャップインフォ,キャップインフォ,正会員,http://www.capinfo.co.jp/
208,キャップクラウド株式会社,キャップクラウド,正会員,https://capcloud.co.jp
209,キャピタル・パートナーズ証券株式会社,キャピタルパートナーズショウケン,一般賛助会員,http://www.capital.co.jp/
210,株式会社キャリアブリッジ,キャリアブリッジ,正会員,https://careerbridge.jp/
211,キャロウェイゴルフ株式会社,キャロウェイゴルフ,正会員,https://www.callawaygolf.jp/
212,キヤノン電子テクノロジー株式会社,キヤノンデンシテクノロジー,正会員,https://www.canon-electec.co.jp/
213,株式会社Ｑｔ,キュート,正会員,http://www.q-trust.co.jp/
214,協立情報通信株式会社,キョウリツジョウホウツウシン,正会員,https://www.kccnet.co.jp/
215,勤次郎株式会社,キンジロウ,正会員,https://www.kinjiro-e.com/
216,キンドリルジャパン株式会社,キンドリルジャパン,正会員,https://www.kyndryl.com/jp/ja
217,株式会社ギガテック,ギガテック,正会員,https://www.giga-tech.co.jp/
218,株式会社ギガプライズ,ギガプライズ,正会員,https://www.gigaprize.co.jp/
219,ギグワークスクロスアイティ株式会社,ギグワークスクロスアイティ,正会員,https://gigxit.co.jp
220,岐阜県　恵那市,ギフケンエナシ,行政会員,https://www.city.ena.lg.jp/
221,株式会社ギフト,ギフト,正会員,https://www.gift-inc.co.jp/
222,クウジット株式会社,クウジット,準会員,https://www.koozyt.com/
223,クオーク株式会社,クオーク,正会員,https://quarq.co.jp/
224,クオリティソフト株式会社,クオリティソフト,正会員,https://www.qualitysoft.com/
225,株式会社QOLET,クオレット,準会員,https://qolet.co.jp
226,株式会社クマヒラ,クマヒラ,正会員,https://www.kumahira.co.jp/
227,一般社団法人組込みシステム技術協会,クミコミシステムギジュツキョウカイ,一般賛助会員,https://www.jasa.or.jp/
228,クラウドエース株式会社,クラウドエース,正会員,https://cloud-ace.jp/
229,株式会社クリエイション,クリエイション,正会員,https://www.creation-j.com/
230,株式会社クリエイティブバンク,クリエイティブバンク,正会員,https://www.creativebank.co.jp/
231,株式会社Crisp Code,クリスプコード,正会員,https://crispcode.co.jp
232,クリューグル株式会社,クリューグル,正会員,https://krugle.co.jp/
233,株式会社クレアンスメアード,クレアンスメアード,正会員,https://www.creansmaerd.co.jp/
234,株式会社クレオ,クレオ,正会員,https://www.creo.co.jp/
235,KROW株式会社,クロー,正会員,https://krow.co.jp/
236,株式会社クロスパワー,クロスパワー,正会員,http://www.x-power.co.jp/
237,株式会社クロスリンク,クロスリンク,正会員,https://crossrink.co.jp/
238,クロノス株式会社,クロノス,正会員,https://www.xronos-inc.co.jp/index.html
239,クワンタム・テクノロジー株式会社,クワンタムテクノロジー,正会員,http://www.quantech.co.jp/
240,グーグル・クラウド・ジャパン合同会社,グーグルクラウドジャパン,正会員,https://cloud.google.com/?hl=ja
241,株式会社グーフ,グーフ,正会員,https://www.goof.buzz/
242,株式会社グッドニュース,グッドニュース,正会員,https://www.goodnews.biz/
243,グラビス・アーキテクツ株式会社,グラビスアーキテクツ,正会員,https://www.glavisarchitects.com/
244,株式会社グリーンキャット,グリーンキャット,正会員,http://www.greencat.co.jp/
245,GRiT Partners 法律事務所,グリットパートナーズホウリツジムショ,正会員,https://www.gritpartnerslaw.jp
246,株式会社グルーヴィーメディア,グルーヴィーメディア,準会員,https://www.groovymedia.jp/
247,株式会社グロースデータ,グロースデータ,正会員,https://growthdata.co.jp/
248,株式会社Globable,グローバブル,正会員,https://globable.jp/
249,株式会社グローバルジャパンネットワーク,グローバルジャパンネットワーク,正会員,https://gjnetwork.jp/
250,グローバルフレンドシップ株式会社,グローバルフレンドシップ,正会員,http://www.gfi.co.jp
251,株式会社グローバルワイズ,グローバルワイズ,正会員,https://www.g-wise.co.jp/
252,株式会社グローブテイルズ,グローブテイルズ,正会員,https://globetails.jp/
253,株式会社ケーイーシー,ケーイーシー,正会員,https://www.kec-sp.com/
254,株式会社K-BIT,ケービット,正会員,https://www.kbit.co.jp/
255,KDDIアジャイル開発センター株式会社,ケイディディアイアジャイルカイハツセンター,正会員,https://kddi-agile.com
256,京葉システム株式会社,ケイヨウシステム,正会員,https://www.keiyo-system.co.jp/
257,株式会社Kdan Japan,ケダンジャパン,正会員,https://www.kdanmobile.com/
258,株式会社建設ドットウェブ,ケンセツドットウェブ,正会員,https://www.kendweb.net/
259,ゲヒルン株式会社,ゲヒルン,正会員,https://www.gehirn.co.jp/
260,株式会社コーエーテクモホールディングス,コーエーテクモホールティングス,正会員,https://www.koeitecmo.co.jp/
261,Co-Evolution株式会社,コーエボリューション,正会員,https://www.co-evo.jp/
262,株式会社コアシンク,コアシンク,正会員,https://www.coresync.co.jp/
263,株式会社コウェル,コウェル,正会員,https://www.co-well.jp/
264,工業会日本万引防止システム協会,コウギョウカイニホンマンビキボウシシステムキョウカイ,一般賛助会員,https://www.jeas.gr.jp/
265,株式会社神戸デジタル・ラボ,コウベデジタルラボ,正会員,https://www.kdl.co.jp/
266,株式会社COEL,コエル,正会員,https://coel-inc.jp/
267,コガソフトウェア株式会社,コガソフトウェア,正会員,https://www.kogasoftware.com/
268,株式会社国和システム,コクワシステム,正会員,https://www.kokuwa.co.jp/
269,コグニビジョン株式会社,コグニビジョン,正会員,https://www.cognivision.jp/
270,株式会社ココスペース,ココスペース,正会員,http://cocospace.com/
271,株式会社コスダック,コスダック,正会員,http://www.cosdac.co.jp/
272,株式会社コスモ・コンピューティングシステム,コスモコンピューティングシステム,正会員,https://cosmocomputing.co.jp/
273,株式会社CoDigital,コデジタル,準会員,https://codigital.co.jp/
274,コナミグループ株式会社,コナミグループ,正会員,https://www.konami.com/
275,株式会社コネクティル,コネクティル,正会員,https://connectill.co.jp
276,コネクトフリー株式会社,コネクトフリー,正会員,https://connectfree.co.jp
277,株式会社Conoris Technologies,コノリステクノロジーズ,正会員,https://www.conoris.jp/
278,株式会社小林労務,コバヤシロウム,準会員,https://www.kobayashiroumu.jp/
279,株式会社コプロシステム,コプロシステム,正会員,http://www.coprosystem.co.jp/
280,コムチュア株式会社,コムチュア,正会員,https://www.comture.com/
281,株式会社comeco,コメコ,正会員,https://comeco1.com/
282,一般社団法人コンピュータソフトウェア著作権協会,コンピュータソフトウェアチョサクケンキョウカイ,一般賛助会員,http://www2.accsjp.or.jp
283,一般社団法人コンピュータソフトウェア倫理機構,コンピュータソフトウェアリンリキコウ,一般賛助会員,http://www.sofurin.org/
284,コンピュータ・テクノロジー株式会社,コンピュータテクノロジー,正会員,http://www.ctc-jp.com/
285,株式会社GO TO MARKET,ゴートゥーマーケット,準会員,https://utilly.jp/company/
286,株式会社サートプロ,サートプロ,正会員,https://www.certpro.jp/
287,株式会社サードウェーブ,サードウェーブ,特別賛助会員,http://info.twave.co.jp/
288,ServiceNow Japan合同会社,サービスナウジャパン,正会員,https://www.servicenow.co.jp/
289,株式会社サイエンスアーツ,サイエンスアーツ,正会員,https://www.science-arts.com
290,サイエンスパーク株式会社,サイエンスパーク,正会員,https://sciencepark.co.jp/
291,サイオステクノロジー株式会社,サイオステクノロジー,正会員,https://sios.jp/
292,株式会社サイズ,サイズ,正会員,http://www.x-yz.co.jp/
293,公益社団法人埼玉県情報サービス産業協会,サイタマケンジョウホウサービスサンギョウキョウカイ,一般賛助会員,http://www.sisia.or.jp/
294,株式会社サイダス,サイダス,正会員,https://www.cydas.com/
295,株式会社サイドクロス,サイドクロス,準会員,https://www.side-cross.com
296,株式会社Cyberデジタル,サイバーデジタル,正会員,http://www.cyber-digital.jp/index.html
297,サイバートラスト株式会社,サイバートラスト,正会員,https://www.cybertrust.co.jp/
298,サイボウズ株式会社,サイボウズ,正会員,https://cybozu.co.jp/
299,佐賀県,サガケン,行政会員,https://www.pref.saga.lg.jp/
300,佐賀県　武雄市,サガケンタケオシ,行政会員,http://www.city.takeo.lg.jp/
301,さくらインターネット株式会社,サクラインターネット,正会員,https://www.sakura.ad.jp/
302,サツドラホールディングス株式会社,サツドラホールディングス,正会員,https://satudora-hd.co.jp/
303,サティス株式会社,サティス,正会員,https://satisjp.com
304,サビテックジャパン株式会社,サビテックジャパン,正会員,http://sabitech.co.jp
305,株式会社サベックス,サベックス,準会員,https://www.sapex.co.jp/
306,株式会社サンテック,サンテック,正会員,http://www.santec.biz/
307,株式会社サンデーアーツ,サンデーアーツ,正会員,https://www.sunday-ja.com/
308,株式会社算法,サンポウ,正会員,https://www.rna.co.jp
309,株式会社サンライズ,サンライズ,正会員,https://sunrise-corp.co.jp/
310,三和コムテック株式会社,サンワコムテック,正会員,https://www.sct.co.jp/
311,サンワサプライ株式会社,サンワサプライ,正会員,http://www.sanwa.co.jp/
312,一般社団法人CRM協議会,シーアールエムキョウギカイ,一般賛助会員,http://www.crma-j.org/
313,株式会社シー・アイ・エス,シーアイエス,正会員,http://www.c-i-s.jp/
314,株式会社シー・エヌ・エス,シーエヌエス,正会員,https://www.cnsinc.jp/
315,株式会社シー・シー・ダブル,シーシーダブル,正会員,https://www.ccw.co.jp/
316,ＣＤＣアクアサービス株式会社,シーデーシーアクアサービス,準会員,
317,株式会社シードソリューションズ,シードソリューションズ,正会員,https://www.seedsolutions.co.jp/
318,株式会社シービーラボ,シービーラボ,正会員,https://www.cblab.jp/
319,株式会社Ｃ６０,シーロクマル,準会員,https://php.c60.co.jp
320,株式会社シイエヌエス,シイエヌエス,正会員,http://www.cns.co.jp/
321,シェアクレスト株式会社,シェアクレスト,正会員,http://sharecrest.com/
322,株式会社シグ,シグ,正会員,https://www.sig-inc.com
323,シグマソフトサービス株式会社,シグマソフトサービス,正会員,https://www.sigmasoft.co.jp/
324,システムアソシエイト株式会社,システムアソシエイト,正会員,http://www.asso48.co.jp
325,株式会社システムエグゼ,システムエグゼ,正会員,https://www.system-exe.co.jp/
326,株式会社システムクエスト,システムクエスト,正会員,http://www.s-quest.co.jp
327,株式会社システムコンサルタント,システムコンサルタント,正会員,https://www.ksc.co.jp/
328,株式会社システムシンク,システムシンク,正会員,http://www.s-think.co.jp/
329,システムズ・デザイン株式会社,システムズデザイン,正会員,https://www.sdcj.co.jp
330,株式会社システムズナカシマ,システムズナカシマ,正会員,https://www.systems.nakashima.co.jp/
331,株式会社システムディ,システムディ,正会員,https://www.systemd.co.jp/
332,株式会社システム・プロデュース,システムプロデュース,正会員,http://www.produce.co.jp
333,システムロード株式会社,システムロード,正会員,http://www.road.co.jp/
334,株式会社シスパル,シスパル,正会員,http://www.syspal.co.jp
335,静岡県　袋井市,シズオカケンフクロイシ,行政会員,http://www.city.fukuroi.shizuoka.jp/
336,株式会社Citadel AI,シタデルエーアイ,準会員,https://www.citadel.co.jp/
337,株式会社シティ・プランニング,シティプランニング,正会員,http://www.cplan.co.jp/
338,株式会社 Siba Service,シバサービス,正会員,https://www.siba-service.jp
339,株式会社シビルソフト開発,シビルソフトカイハツ,正会員,http://www.civil.co.jp/
340,公益財団法人しまね産業振興財団,シマネサンギョウシンコウザイダン,一般賛助会員,https://www.joho-shimane.or.jp/
341,社会システム株式会社,シャカイシステム,正会員,http://www.crp.co.jp/
342,株式会社社会情報サービス,シャカイジョウホウサービス,正会員,https://www.ssri.com/
343,社会保険労務士池田事務所,シャカイホケンロウムシイケダジムショ,正会員,http://www.ikeda-office.jp/
344,社会保険労務士法人ステディ,シャカイホケンロウムシホウジンステディ,準会員,https://steady-sr.com/
345,Sharin株式会社,シャリン,正会員,https://sharin.co.jp/
346,秀峰システム株式会社,シュウホウシステム,正会員,http://www.syuhou.co.jp/
347,首都圏ソフトウェア協同組合,シュトケンソフトウェアキョウドウクミアイ,正会員,http://www.syutoken.or.jp/
348,株式会社正栄設計事務所,ショウエイセッケイジムショ,正会員,http://www.shoei-sekkei.co.jp/
349,白潟総合研究所株式会社,シラガタソウゴウケンキュウジョ,正会員,https://www.ssoken.co.jp/
