no,name,kana,type,url
350,silvereye株式会社,シルバーアイ,準会員,https://www.silvereye.jp/
351,株式会社SHiRO,シロ,正会員,https://kokoshiro.jp/
352,株式会社CINCA,シンカ,準会員,https://cinca.tokyo/
353,株式会社シンクスバンク,シンクスバンク,正会員,https://www.thinkethbank.co.jp/
354,株式会社シンクライアント総合研究所,シンクライアントソウゴウケンキュウジョ,正会員,http://www.tcri.jp
355,株式会社新進商会,シンシンショウカイ,正会員,https://www.ssnet.co.jp/
356,シンプレクス株式会社,シンプレクス,正会員,https://www.simplex.inc/
357,株式会社シンプレックス,シンプレックス,正会員,http://www.simplex-soft.com/
358,株式会社シンメトリア,シンメトリア,正会員,http://www.symmetria.co.jp
359,株式会社シンメトリクス,シンメトリクス,正会員,https://symmetrix.co.jp/
360,株式会社G-gen,ジージェン,正会員,https://www.g-gen.co.jp/
361,株式会社ジーニー,ジーニー,正会員,https://geniee.co.jp/
362,株式会社ジーニアスエイト,ジーニアスエイト,正会員,https://www.genius-8.co.jp/
363,株式会社ジーネクスト,ジーネクスト,正会員,http://www.gnext.co.jp/
364,ジーフィット株式会社,ジーフィット,正会員,https://www.tradom.jp/company
365,株式会社Zene,ジーン,正会員,https://www.zene.co.jp/
366,株式会社ジェイ・マックス,ジェイ・マックス,正会員,https://www.jmaxinc.com/
367,株式会社ジェイジェイエスプラス,ジェイジェイエスプラス,正会員,https://jjsplus.co.jp/
368,有限会社ジェイズシステムズ,ジェイズシステムズ,正会員,http://www.js-systems.co.jp
369,JBアドバンスト・テクノロジー株式会社,ジェイビーアドバンストテクノロジー,正会員,https://www.jbat.co.jp/
370,ジェネシス株式会社,ジェネシス,正会員,https://www.genesys.gr.jp/
371,ジオテクノロジーズ株式会社,ジオテクノロジーズ,正会員,https://geot.jp
372,株式会社jig.jp,ジグジェイピー,正会員,https://www.jig.jp/
373,学校法人 滋慶学園 東京情報デザイン専門職大学,ジケイガクエン トウキョウジョウホウデザインセンモンショクダイガク,一般賛助会員,https://www.tid.ac.jp/
374,合同会社ジザイ,ジザイ,準会員,
375,JAPAN AI株式会社,ジャパンエーアイ,正会員,https://japan-ai.co.jp/
376,一般社団法人重要生活機器連携セキュリティ協議会,ジュウヨウセイカツキキレンケイセキュリティキョウギカイ,一般賛助会員,http://www.ccds.or.jp
377,ジョーシス株式会社,ジョーシス,正会員,https://jp.corp.josys.com/
378,情報技術開発株式会社,ジョウホウギジュツカイハツ,正会員,http://www.tdi.co.jp/
379,株式会社情報技術センター,ジョウホウギジュツセンター,正会員,https://www.itc-net.co.jp/
380,一般社団法人情報サービス産業協会,ジョウホウサービスサンギョウキョウカイ,一般賛助会員,https://www.jisa.or.jp/
381,株式会社情報処理システム研究所,ジョウホウショリシステムケンキュウジョ,正会員,http://www.infsys.co.jp/
382,一般社団法人情報通信ネットワーク産業協会,ジョウホウツウシンネットワークサンギョウキョウカイ,一般賛助会員,http://www.ciaj.or.jp/
383,株式会社ジラフ計画,ジラフケイカク,正会員,
384,株式会社SUPER STUDIO,スーパースタジオ,正会員,https://super-studio.jp
385,スイフトテクノロジー株式会社,スイフトテクノロジー,準会員,https://www.swift-tech.co.jp/
386,株式会社スカイエージネクスト,スカイエージネクスト,準会員,https://www.skyage.co.jp/
387,スキャネット株式会社,スキャネット,正会員,https://www.scanet.jp/
388,株式会社鈴木商店,スズキショウテン,正会員,https://www.suzukishouten.co.jp
389,STAR SE株式会社,スターエスイー,正会員,http://www.star-se.co.jp/
390,スターティアレイズ株式会社,スターティアレイズ,正会員,https://www.startiaraise.co.jp/
391,STAR TECH 株式会社,スターテック,準会員,https://www.startech.co.jp/
392,株式会社STAAAGE,ステージ,準会員,https://www.nodastage.com
393,ストーンビートセキュリティ株式会社,ストーンビートセキュリティ,正会員,https://www.stonebeat.co.jp/
394,STORES 株式会社,ストアーズ,正会員,https://www.st.inc/
395,株式会社ストライク,ストライク,正会員,https://www.strike.co.jp/
396,株式会社ストラテジーテック・コンサルティング,ストラテジーテックコンサルティング,正会員,https://www.strategy-tec.com/
397,株式会社ストラテジット,ストラテジット,正会員,https://www.strategit.jp
398,スパイクシステムズ株式会社,スパイクシステムズ,正会員,https://www.spikes.co.jp
399,株式会社スプラッシュ,スプラッシュ,正会員,https://splash.jp/
400,株式会社Smart Delivery,スマートデリバリー,正会員,https://smart-delivery.jp
401,株式会社スマレジ,スマレジ,正会員,https://corp.smaregi.jp/
402,SALES GO株式会社,セールスゴー,正会員,https://salesgo.co.jp/
403,セイ・テクノロジーズ株式会社,セイテクノロジーズ,正会員,https://www.say-tech.co.jp/
404,株式会社セゾンテクノロジー,セゾンテクノロジー,正会員,https://www.saison-technology.com/
405,株式会社セック,セック,正会員,https://www.sec.co.jp/
406,株式会社セブン＆アイ・ネットメディア,セブンアンドアイネットメディア,正会員,https://www.7andinm.co.jp/
407,株式会社7th Basement,セブンスベースメント,正会員,https://www.7thbasement.com/
408,センターフィールド株式会社,センターフィールド,正会員,https://centerfield.co.jp/
409,株式会社SENTAN,センタン,正会員,https://www.sentan-tech.com/
410,株式会社セントジェームズアソシエイツ,セントジェームズアソシエイツ,正会員,
411,税理士齋藤康之事務所,ゼイリシサイトウヤスユキジムショ,正会員,http://www.zei-saito.com/
412,ゼッタテクノロジー株式会社,ゼッタテクノロジー,正会員,http://www.zetta.co.jp/
413,全国商工会連合会,ゼンコクショウコウカイレンゴウカイ,一般賛助会員,https://www.shokokai.or.jp/
414,全国ソフトウェア協同組合連合会,ゼンコクソフトウェアキョウドウクミアイレンゴウカイ,一般賛助会員,http://www.jaspanet.or.jp
415,一般社団法人全国地域情報産業団体連合会,ゼンコクチイキジョウホウサンギョウダンタイレンゴウカイ,一般賛助会員,http://www.ania.jp/
416,株式会社ZenmuTech,ゼンムテック,正会員,https://zenmutech.com/
417,ソーバル株式会社,ソーバル,正会員,https://www.sobal.co.jp/
418,創研情報株式会社,ソウケンジョウホウ,正会員,https://www.souken.co.jp/
419,株式会社想隆社,ソウリュウシャ,正会員,https://soryu-sha.jp/
420,株式会社ソフィア・システム・サービス,ソフィアシステムサービス,正会員,https://www.sssv.co.jp/
421,株式会社ソフエル,ソフエル,正会員,https://www.sofel.co.jp
422,ソフトイーサ株式会社,ソフトイーサ,正会員,https://www.softether.co.jp/
423,一般財団法人ソフトウェア情報センター,ソフトウェアジョウホウセンター,一般賛助会員,http://www.softic.or.jp/
424,株式会社ソフトクリエイトホールディングス,ソフトクリエイトホールディングス,正会員,https://www.softcreate-holdings.co.jp/
425,ソフトバンク株式会社,ソフトバンク,正会員,https://www.softbank.jp/corp/aboutus/
426,ソフトヒューベリオン株式会社,ソフトヒューベリオン,正会員,https://soft-hyperion.com/
427,ソリマチ株式会社,ソリマチ,正会員,https://www.sorimachi.co.jp/
428,株式会社ソリューション・アンド・テクノロジー,ソリューションアンドテクノロジー,正会員,https://www.solty.co.jp/
429,SOMPOシステムズ株式会社,ソンポシステムズ,正会員,http://www.sompo-sys.com
430,ゾイックス株式会社,ゾイックス,正会員,https://www.zoiccs.co.jp/
431,合同会社ZONER,ゾナー,準会員,https://www.zoner.com/jp
432,株式会社タイミー,タイミー,正会員,https://timee.co.jp/
433,株式会社TIME MACHINE,タイムマシーン,準会員,https://schecon.com/article/
434,TAC株式会社,タック,正会員,https://www.tac-school.co.jp/
435,株式会社たのえん,タノエン,準会員,https://www.sieps.site/
436,株式会社ダイナックス,ダイナックス,正会員,http://www.dynax.co.jp
437,株式会社大和コンピューター,ダイワコンピューター,正会員,https://www.daiwa-computer.co.jp/jp/
438,ダイワボウ情報システム株式会社,ダイワボウジョウホウシステム,正会員,https://www.pc-daiwabo.co.jp/
439,ダックス株式会社,ダックス,正会員,https://duksholdings.co.jp/
440,株式会社DUMSCO,ダムスコ,正会員,https://dumsco.com/
441,株式会社チェプロ,チェプロ,正会員,http://www.chepro.co.jp/
442,公益社団法人千葉県情報サービス産業協会,チバケンジョウホウサービスサンギョウキョウカイ,一般賛助会員,http://www.chisa.gr.jp/
443,中小企業福祉事業団,チュウショウキギョウフクシジギョウダン,正会員,https://www.chukidan.jp/
444,長城コンサルティング株式会社,チョウジョウコンサルティング,正会員,http://www.chojo.co.jp/
445,株式会社チラシレポート,チラシレポート,正会員,https://www.chirashi.co.jp/
446,株式会社ツクリテ,ツクリテ,正会員,https://www.tkrite.com/
447,辻・本郷ＩＴコンサルティング株式会社,ツジホンゴウアイティーコンサルティング,正会員,https://ht-itc.jp/
448,株式会社TDA,ティーディーエー,準会員,https://www.tda-corp.co.jp/
449,株式会社TBTソリューションズ,ティービーティーソリューションズ,正会員,https://tbt-s.jp/
450,T-Link株式会社,ティーリンク,正会員,https://t-linkcompany.com/
451,株式会社ティ・エス・サービス,ティエスサービス,正会員,
452,TISCOINF株式会社,ティスコインフ,正会員,https://www.tiscoinf.co.jp/
453,株式会社TKC,テイケイシイ,正会員,https://www.tkc.jp/
454,株式会社テクノス秋田,テクノスアキタ,正会員,http://www.tks-akita.co.jp/
455,株式会社鉄飛テクノロジー,テッピテクノロジー,正会員,https://www.teppi.com/
456,一般社団法人テレコムサービス協会,テレコムサービスキョウカイ,一般賛助会員,http://www.telesa.or.jp/
457,株式会社テンダ,テンダ,正会員,https://www.tenda.co.jp/
458,データ・タング株式会社,データタング,正会員,https://www.datatang.co.jp/
459,DATAビジネス株式会社,データビジネス,正会員,https://databusiness.co.jp/
460,一般社団法人データビリティコンソーシアム,データビリティコンソーシアム,一般賛助会員,https://cds.or.jp/
461,株式会社データロジック,データロジック,正会員,http://www.datalogic.co.jp/
462,株式会社DNPハイパーテック,ディーエヌピーハイパーテック,正会員,https://www.hypertech.co.jp/
463,ＤＮＶビジネス・アシュアランス・ジャパン株式会社,ディーエヌブイビジネスアシュアランスジャパン,正会員,https://www.dnv.jp/ss_and_sus/index.html
464,DELE株式会社,ディーリー,正会員,https://dele.gr/
465,株式会社DYM,ディーワイエム,正会員,https://dym.asia
466,株式会社ＤＮＡ ＦＡＣＴＯＲ,ディエヌエーファクター,準会員,https://dna-factor.com/
467,DXYZ株式会社,ディクシーズ,準会員,https://dxyz.co.jp/
468,株式会社ディジタル,ディジタル,正会員,https://www.digital-corp.co.jp
469,株式会社デザイン・クリエィション,デザインクリエィション,正会員,https://www.dcrea.co.jp/
470,デザインファースト株式会社,デザインファースト,正会員,https://designfirst.co.jp/
471,株式会社デジタルグローバルシステムズ,デジタルグローバルシステムズ,正会員,https://www.dgs-j.com/
472,有限会社デジタルパイプライン,デジタルパイプライン,正会員,https://www.digitalpipeline.jp/
473,株式会社デジタルファクター,デジタルファクター,正会員,http://www.digitalfactor.co.jp/
474,デジタルみらい株式会社,デジタルミライ,正会員,https://www.digitalmirai.co.jp
475,株式会社デジック,デジック,正会員,https://www.dgic.co.jp/
476,株式会社DeltaX,デルタエックス,準会員,https://delta-x.co.jp/
477,トーワシステムサポート株式会社,トーワシステムサポート,正会員,http://www.towas.co.jp/
478,東海ビジネスサービス株式会社,トウカイビジネスサービス,正会員,http://www.tokai-bs.co.jp/
479,東京システムハウス株式会社,トウキョウシステムハウス,正会員,https://www.tsh-world.co.jp/
480,東京新峰科技株式会社,トウキョウシンホウカギ,正会員,http://www.newtop-j.com
481,東京ソフトウエア株式会社,トウキョウソフトウエア,正会員,http://www.tokyosoft.co.jp/
482,一般社団法人東京都情報産業協会,トウキョウトジョウホウサンギョウキョウカイ,一般賛助会員,https://iit.or.jp/
483,東群トラック株式会社,トウグントラック,準会員,https://www.tougun-truck.co.jp/
484,統合医療アール研究所株式会社,トウゴウイリョウアールケンキュウショ,正会員,
485,東芝エネルギーシステムズ株式会社,トウシバエネルギーシステムズカブシキカイシャ,正会員,https://www.global.toshiba/jp/company/energy.html
486,東洋システム開発株式会社,トウヨウシステムカイハツ,正会員,https://www.tsknet.co.jp/
487,株式会社とめ研究所,トメケンキュウショ,正会員,https://www.tome.jp
488,株式会社 Trust Force,トラストフォース,準会員,
489,株式会社toraru,トラル,正会員,http://toraru.co.jp/
490,tripla株式会社,トリプラ,正会員,https://corp.tripla.jp
491,株式会社トリプルアイズ,トリプルアイズ,正会員,https://www.3-ize.jp/
492,株式会社ＴＲＡＤＥＣＲＥＡＴＥ,トレードクリエイト,正会員,http://www.tradecreate.com/
493,株式会社TREASURY,トレジャリー,正会員,https://treasury.jp/
494,株式会社トレセン,トレセン,正会員,https://tresen.co.jp
495,トレンドマイクロ株式会社,トレンドマイクロ,正会員,https://www.trendmicro.co.jp/
496,一般社団法人道路・舗装技術研究協会,ドウロホソウギジュツケンキュウキョウカイ,正会員,http://parowaytec.jp/
497,株式会社ドライビングフォース,ドライビングフォース,正会員,https://www.drivingforce.co.jp/
498,株式会社ドリームソリューション,ドリームソリューション,準会員,https://solutionds1.co.jp/
499,株式会社ドリームパイプライン,ドリームパイプライン,正会員,https://dreampipeline.com/
500,株式会社ドリームファクトリーワールドワイド,ドリームファクトリーワールドワイド,正会員,https://www.dfww.jp/
501,株式会社ドリームプランニング,ドリームプランニング,正会員,https://dream-plan.com
502,株式会社ナイモノ,ナイモノ,正会員,https://naimono.co.jp/
503,中本総合法律事務所,ナカモトソウゴウホウリツジムショ,正会員,http://www.nakamotopartners.com/
504,長野県　長野市,ナガノケンナガノシ,行政会員,https://www.city.nagano.nagano.jp/
505,ナッジヘルステック株式会社,ナッジヘルステック,準会員,https://nudge-ht.jp/
506,株式会社ナノオプト・メディア,ナノオプトメディア,正会員,http://www.f2ff.jp/
507,株式会社knowledge Act,ナレッジアクト,準会員,https://www.knowledge-act.co.jp/
508,新潟県　新潟市,ニイガタケン　ニイガタシ,行政会員,https://www.city.niigata.lg.jp/
509,学校法人新潟総合学院開志専門職大学,ニイガタソウゴウガクインカイシセンモンショクダイガク,一般賛助会員,https://kaishi-pu.ac.jp/
510,日研システム株式会社,ニッケンシステム,正会員,http://www.nikkensystem.co.jp/index.do
511,日興ソフトウェア株式会社,ニッコウソフトウェア,正会員,http://www.nikkou-soft.co.jp/
512,日昌電気制御株式会社,ニッショウデンキセイギョ,準会員,https://realfocus.nisshodenkiseigyo.com/?referral=CM2310
513,ニッセイ情報テクノロジー株式会社,ニッセイジョウホウテクノロジー,正会員,https://www.nissay-it.co.jp/
514,日本事務器株式会社,ニッポンジムキ,正会員,https://www.njc.co.jp/
515,日本電気株式会社,ニッポンデンキ,特別賛助会員,https://jpn.nec.com/
516,一般社団法人日本ＩＴＡＤ協会,ニホンアイタッドキョウカイ,一般賛助会員,http://itad.or.jp
517,日本ITソフトウェア企業年金基金,ニホンアイティソフトウェアキギョウネンキンキキン,一般賛助会員,https://www.its-kikin.or.jp/
518,日本キスコ株式会社,ニホンキスコ,正会員,http://www.kissco.co.jp
519,一般社団法人日本コンピュータシステム販売店協会,ニホンコンピュータシステムハンバイテンキョウカイ,一般賛助会員,https://www.jcssa.or.jp
520,日本システム開発株式会社,ニホンシステムカイハツ,正会員,https://www.nskint.co.jp/
521,日本システム開発株式会社,ニホンシステムカイハツ,正会員,https://www.nsk.co.jp/
522,株式会社日本システムデザイン,ニホンシステムデザイン,正会員,http://www.ns-design.jp/
523,株式会社日本システムブレーンズ,ニホンシステムブレーンズ,正会員,http://www.nsb.jp/
524,株式会社日本シャルフ,ニホンシャルフ,正会員,http://www.shalf.jp
525,一般財団法人日本生涯学習総合研究所,ニホンショウガイガクシュウソウゴウケンキュウジョ,準会員,https://www.shogai-soken.or.jp/
526,特定非営利活動法人日本情報技術取引所,ニホンジョウホウギジュツトリヒキジョ,一般賛助会員,https://www.jiet.or.jp/
527,一般社団法人日本情報システム・ユーザー協会,ニホンジョウホウシステムユーザーキョウカイ,一般賛助会員,https://juas.or.jp/
528,日本スーパーマップ株式会社,ニホンスーパーマップ,正会員,https://supermap.jp/
529,一般社団法人日本中小企業スマートビジネス推進協会,ニホンチュウショウキギョウスマートビジネススイシンキョウカイ,一般賛助会員,https://smartbiz.or.jp/
530,日本通信エレクトロニック株式会社,ニホンツウシンエレクトロニック,正会員,http://www.jacom.com/
531,日本ティーマックスソフト株式会社,ニホンティーマックスソフト,正会員,https://www.tmaxsoft.co.jp/
532,一般社団法人日本テレワーク協会,ニホンテレワークキョウカイ,一般賛助会員,https://japan-telework.or.jp/
533,一般社団法人日本ディープラーニング協会,ニホンディープラーニングキョウカイ,一般賛助会員,https://www.jdla.org/
534,日本デジタルデザイン株式会社,ニホンデジタルデザイン,正会員,http://www.ndd-net.co.jp/
535,日本ナレッジ株式会社,ニホンナレッジ,正会員,http://www.know-net.co.jp/
536,特定非営利活動法人日本ネットワークセキュリティ協会,ニホンネットワークセキュリティキョウカイ,一般賛助会員,https://www.jnsa.org/
537,一般社団法人日本農業情報システム協会,ニホンノウギョウジョウホウシステムキョウカイ,一般賛助会員,https://jaisa.org/
538,一般財団法人日本パソコンスクール協会,ニホンパソコンスクールキョウカイ,一般賛助会員,https://jpsa.or.jp/
539,日本ビズアップ株式会社,ニホンビズアップ,正会員,https://www.bizup.co.jp/
540,一般社団法人日本ピルビスワーク協会,ニホンピルビスワークキョウカイ,正会員,https://pelviswork.com/
541,日本マイクロソフト株式会社,ニホンマイクロソフト,正会員,https://www.microsoft.com/ja-jp
542,NewIT株式会社,ニューアイティ,正会員,https://newit.co.jp
543,ニュートラル株式会社,ニュートラル,正会員,https://www.neut.co.jp/
544,ニューマネジメントシステム株式会社,ニューマネジメントシステム,正会員,https://www.nmsc.co.jp/
545,一般財団法人ニューメディア開発協会,ニューメディアカイハツキョウカイ,一般賛助会員,https://www2.nmda.or.jp/
546,株式会社Nex-E,ネクシィ,正会員,https://www.nex-e.co.jp/
547,ネクストウェア株式会社,ネクストウェア,正会員,https://www.nextware.co.jp/
548,株式会社ネクストスケープ,ネクストスケープ,正会員,https://www.nextscape.net/
549,株式会社NEXT TECHNOLOGY,ネクストテクノロジー,正会員,https://nexttechnology.jp/
550,株式会社ネクストビジョン,ネクストビジョン,正会員,https://www.nextvision.co.jp/
551,有限会社ネットアイ,ネットアイ,準会員,http://www.net-i.jp
552,株式会社ネットウイズ,ネットウイズ,正会員,https://www.netwith.jp/
553,株式会社ネットショップ支援室,ネットショップシエンシツ,正会員,https://netshop-pro.jp/
554,ネットレコーダー・ソリューションズ株式会社,ネットレコーダーソリューションズ,正会員,http://www.netrecorder.jp/
555,野村證券株式会社,ノムラショウケン,一般賛助会員,http://www.nomura.co.jp/
556,株式会社Ｈａｒｎｅｓｓ　ＬＬＰ,ハーネスエルエルピー,正会員,http://www.harness.bz/
557,ハイネスソリューションズ株式会社,ハイネスソリューションズ,正会員,http://www.kj-hns.com
558,株式会社Hammy's,ハミーズ,準会員,https://hammys.co.jp/
559,株式会社バーズ情報科学研究所,バーズジョウホウカガクケンキュウジョ,正会員,http://www.birds.co.jp/
560,株式会社バイトルヒクマ,バイトルヒクマ,正会員,https://bai.co.jp/
561,株式会社バッファロー,バッファロー,正会員,https://www.buffalo.jp/
562,株式会社batton,バトン,正会員,https://batton.co.jp
563,株式会社バリューソフトウエア,バリューソフトウェア,正会員,https://www.valuenet.co.jp/
564,株式会社パーソナルデザイン,パーソナルデザイン,正会員,http://www.pdn.jp/
565,パートナーサクセス株式会社,パートナーサクセス,正会員,https://partnersuccess.jp/
566,パイオネット・ソフト株式会社,パイオネットソフト,正会員,https://pionet.co.jp/
567,ｐａｉｚａ株式会社,パイザ,正会員,https://www.paiza.co.jp/
568,株式会社パスカリア,パスカリア,正会員,https://www.pascalia.co.jp/
569,株式会社パルソラ,パルソラ,正会員,https://www.parsola.com/
570,ひばりネットシステム株式会社,ヒバリネットシステム,正会員,http://www.hibarinet.co.jp/
571,株式会社ヒューアップテクノロジー,ヒューアップテクノロジー,正会員,https://www.huapp.co.jp
572,ヒューマンアカデミー株式会社,ヒューマンアカデミー,試験会場会員,http://haa.athuman.com/
573,株式会社ヒューマンキャピタル研究所,ヒューマンキャピタルケンキュウジョ,正会員,https://hci-inc.co.jp/
574,株式会社ヒューマンテクノロジーズ,ヒューマンテクノロジーズ,正会員,
575,社会保険労務士法人ヒューマン・プライム,ヒューマンプライム,正会員,https://www.humanprime.co.jp
576,平川社会保険労務士事務所,ヒラカワシャカイホケンロウムシジムショ,正会員,https://hirakawa-sr.jp/
577,広島県　広島市,ヒロシマケンヒロシマシ,行政会員,https://www.city.hiroshima.lg.jp
578,株式会社b-ex,ビーエックス,正会員,https://www.b-ex.inc/
579,株式会社BCN,ビーシーエヌ,一般賛助会員,https://www.bcn.co.jp
580,ＢＣ Ｓｉｇｎｐｏｓｔ株式会社,ビーシーサインポスト,正会員,
581,BBIX株式会社,ビービーアイエックス,正会員,https://www.bbix.net/
582,BBSakura Networks株式会社,ビービーサクラネットワークス,正会員,https://www.bbsakura.net/
583,BBソフトサービス株式会社,ビービーソフトサービス,正会員,https://www.bbss.co.jp
584,株式会社ビジコン・ジャパン,ビジコンジャパン,正会員,https://jbca.co.jp/
585,株式会社ビナヤマト,ビナヤマト,正会員,https://www.vinayamato.com
586,株式会社ピーエスシー,ピーエスシー,正会員,https://www.psc-inc.co.jp/
587,ピーシーアシスト株式会社,ピーシーアシスト,試験会場会員,http://www.winschool.jp/
588,ピー・シー・エー株式会社,ピーシーエー,正会員,https://pca.jp/
589,株式会社Pionero,ピオネロ,正会員,https://www.pionero.io/ja/
590,株式会社PICK,ピック,準会員,https://pick-hp.com/
